{
  "pipeline_id": "sr_amp",
  "run": {
    "work_dir": "/Users/izzydavidson/Desktop/PhD/Projects/STaBioM-Standardised-Bioinformatics-for-Microbial-samples/shiny-ui/data/outputs",
    "run_id": "SR_AMP_PAIRED_Test_01",
    "force_overwrite": 1
  },
  "technology": "ILLUMINA",
"input": {
  "style": "FASTQ_PAIRED",
  "fastq_r1": "/Users/izzydavidson/Desktop/PhD/Projects/STaBioM-Standardised-Bioinformatics-for-Microbial-samples/shiny-ui/data/test_inputs/test_R1.fastq",
  "fastq_r2": "/Users/izzydavidson/Desktop/PhD/Projects/STaBioM-Standardised-Bioinformatics-for-Microbial-samples/shiny-ui/data/test_inputs/test_R2.fastq"
},
  "resources": {
    "threads": 16
  },
  "params": {
    "common": {
      "min_qscore": 0,
      "remove_host": 0
    }
  },
  "output": {
    "selected": ["sr_amp_qzv", "feature_table", "taxonomy"]
  }
}
