{
  "pipeline_id": "lr_amp",
  "run": {
    "work_dir": "/Users/izzydavidson/Desktop/PhD/Projects/STaBioM-Standardised-Bioinformatics-for-Microbial-samples/shiny-ui/data/outputs",
    "run_id": "",
    "force_overwrite": 1
  },
  "technology": "ONT",
  "input": {
    "style": "FASTQ_SINGLE",
    "fastq_r1": "/Users/izzydavidson/Desktop/PhD/Projects/STaBioM-Standardised-Bioinformatics-for-Microbial-samples/shiny-ui/data/test_inputs/test.fastq"
  },
  "resources": {
    "threads": 16
  },
  "params": {
    "common": {
      "min_qscore": 10,
      "remove_host": 0
    }
  },
  "output": {
    "selected": ["multiqc", "amplicon_results"]
  }
}
