{
  "pipeline_id": "sr_amp",
  "technology": "ILLUMINA",
  "specimen": "vaginal",
  "run": {
    "work_dir": "runs",
    "run_id": "sr_amp_single_test",
    "force_overwrite": 1
  },
  "input": {
    "style": "FASTQ_SINGLE",
    "fastq_r1": "data/fastq/barcode01.fastq.gz"
  },
  "resources": {
    "threads": 8
  },
  "params": {
    "common": {
      "min_qscore": 10,
      "remove_host": 0
    }
  },
  "qiime2": {
    "sample_id": "barcode01",
    "primers": {
      "forward": "",
      "reverse": ""
    },
    "classifier": {
      "qza": ""
    },
    "dada2": {
      "trim_left_f": 0,
      "trunc_len_f": 230,
      "n_threads": 0
    },
    "diversity": {
      "sampling_depth": 0,
      "metadata_tsv": ""
    }
  },
  "valencia": {
    "mode": "auto"
  },
  "output": {
    "selected": ["default"]
  }
}
